approved_at_utc,subreddit,author_fullname,title,name
,politics,t2_69yyt5ry,Black Detroit voters sue Trump campaign over effort to invalidate election results,t3_jykgfn
,politics,t2_28tho63f,Trump denies Georgia's results after hand recount; prompts concerns over January's Senate runoff,t3_jykdgu
,politics,t2_4iv7uakz,‘My Frustration Turned Into Anger.’ Some Americans Who Lost Family Members to COVID-19 Have Turned Against Donald Trump,t3_jyk8mk
,politics,t2_4uujtoat,Trump campaign again seeks to stop certification of Pennsylvania's election results,t3_jyk7x7
,politics,t2_5ltyx5b7,The Desperate Final Gasps of Team Trump’s Flailing ‘Mini-Coup’,t3_jyk5l1
,politics,t2_3akhzmes,Wisconsin officials: Trump observers obstructing recount,t3_jyk59x
,politics,t2_yqnnh,Liz Cheney: Trump should respect ‘the sanctity of our electoral process’,t3_jyk4r9
,politics,t2_hhq3wyu,Florida man still pitching trailer park as site of future Trump presidential library,t3_jyk38k
,politics,t2_63uw6h9r,Obamas producing comedy series about chaos of the Trump administration,t3_jyk12v
,politics,t2_5gg1dt,Trump privately plots his next act - including a potential 2024 rematch,t3_jyjz6o
,politics,t2_2surpeqs,Romney vs. Chachi? Actor Scott Baio threatens to run against Utah senator in 2024 over Trump rebuke.,t3_jyjx9m
,politics,t2_25vq6ime,Trump Chooses Golf Over Virtual COVID-19 Meeting With World Leaders,t3_jyjw12
,politics,t2_2uwit82z,'A Disgrace': Trump's DOJ Schedules Three More Federal Executions in Days Before Anti-Death Penalty Biden Takes Office,t3_jyjvqh
,politics,t2_5ltyx5b7,"Battered by failures to reverse Biden win, Trump, allies persist with fraud claims",t3_jyjt9q
,politics,t2_17oyn7va,Election 2020 updates: Michigan GOP Speaker Chatfield drinks at Trump Hotel; Carson was 'desperately ill' from COVID,t3_jyjoh2
,politics,t2_3zi4nxr,Trump Campaign Lawyers File New Pennsylvania Motion Which Misspells Governor’s Name,t3_jyjnr1
,politics,t2_yxo2uic,Wisconsin officials: Trump observers obstructing recount,t3_jyjecp
,politics,t2_ys7tq,Wisconsin officials: Trump observers obstructing recount,t3_jyjcxb
,politics,t2_2furipfe,Michigan Democrats are taking a stand against Trump's campaign to steal the state's vote,t3_jyj7a6
,politics,t2_4ce6zkee,Judge bars Trump appointee from interfering in Voice of America,t3_jyj74r
,politics,t2_3krs0,AP Fact Check: Trump's flailing effort resting on mendacity,t3_jyj6sy
,politics,t2_j6ia7,Judge rules against Trump global media chief after firings,t3_jyj6r2
,politics,t2_46hu7r3z,Detroit voters sue Donald Trump over unsubstantiated claims of voter fraud,t3_jyj5z6
,politics,t2_3mgo4fkq,Michigan Group Sues Trump for Disenfranchising Black Voters,t3_jyj43l
,politics,t2_d0rgw,Biden's Student Loan Forgiveness Plan Is Idiotic and Immoral,t3_jyj34g
,politics,t2_hhq3wyu,'GOP made a bed of nails': Scaramucci on Republicans appeasing Trump,t3_jyj1x6
,politics,t2_wwj7h,Trump does not participate in G-20 event on global pandemic preparedness,t3_jyix42
,politics,t2_3ayh8p6y,‘Do they just not care?’ Miami immigrants troubled by surge of Latino support for Trump,t3_jyirvl
,politics,t2_yhr4v,"For Netanyahu and Israel, Trump’s Gifts Kept on Coming. Allowing the convicted spy Jonathan Pollard the ability to emigrate to Israel was just the latest in a long list of prizes for America’s closest ally in the Middle East.",t3_jyiov7
,politics,t2_6fwhm80h,"Trump attacks big Pharma, announces programs to lower drug prices",t3_jyiop6
,politics,t2_3n1iu89i,Sen. Graham says Biden should have access to classified intelligence briefings,t3_jyiofw
,politics,t2_cw1518p,"Yes, Trump Is (Still) Engaged in an Attempted Coup; and Yes, It Might Lead to a Constitutional Crisis and a Breaking Point",t3_jyih12
,politics,t2_q9v5n,"If you think Biden's administration will rein in big tech, think again — The US president-elect is reported to have appointed former employees of Facebook and Amazon to his transition team",t3_jyif1k
,politics,t2_7ril8nm4,Republican Resistance Looms in the Senate for Biden’s Nominees,t3_jyiblz
,politics,t2_pcpyq,"Trump addresses virtual G-20 summit, heads out before session on pandemic",t3_jyibg1
,politics,t2_w8l39,Trump steps on Michigan lawmakers' message in tweets after meeting,t3_jyi6td
,politics,t2_3ie9x,"With Trump victory in Florida, the state turned a deeper red. What does it mean for future elections?",t3_jyi6gg
,politics,t2_4q17i,Trump goes golfing in middle of G20 summit,t3_jyi5ye
,politics,t2_2rmbxzoe,Impeach the president again — Removal from office wouldn’t be the goal this time. It would be to prevent Trump from running again.,t3_jyi4xi
,politics,t2_2uwit82z,Trump Skips G20 Pandemic Preparedness Meeting as Covid-19 Cases Surpass 12 Million in US,t3_jyi47r
,politics,t2_3qii52du,"Trump campaign ""seeking to disenfranchise Black voters"" with election fraud claims: lawsuit",t3_jyi1mt
,politics,t2_27krnf7o,Trump Is Staging a Comically Incompetent Coup — It would almost be possible to laugh at this debacle if the stakes weren’t so serious.,t3_jyi19h
,politics,t2_3bvoczt4,Trump was pictured on his Virginia golf course during a coronavirus meeting for G20 leaders,t3_jyhv9o
,politics,t2_5wdhyhfw,Obama jokes that Navy SEALs could remove Trump from the White House,t3_jyhutc
,politics,t2_2rmbxzoe,Pompeo’s Grotesque Farewell Party in Israel Shows That the Trump Team Knows It's Over — Pompeo used his visit to Israel and the settlements to push forward his pet ideological project and advance his post-Trump political career.,t3_jyht3y
,politics,t2_3jjsa,Trump skips G20 pandemic event to visit golf club as virus ravages US,t3_jyhrl0
,politics,t2_3rcoj7et,Trump’s failure to work with Biden is becoming more urgent as Covid spreads,t3_jyhqa5
,politics,t2_d0rgw,To Compare Trump to Hitler is to Insult the American People,t3_jyhpv7
,politics,t2_97a3,Op-Ed: Why Biden should look beyond the usual pool for his Cabinet appointments,t3_jyhm4p
,politics,t2_25vq6ime,"Week offers snapshot of how Trump, Biden approach presidency",t3_jyhl23
,politics,t2_5ltyx5b7,Judge rules against Trump global media chief after firings,t3_jyhkqu
,politics,t2_7mfq73lx,Trump skips G20 coronavirus meeting to play golf and tweet bogus election claims,t3_jyhjr0
,politics,t2_w8l39,President says Trump Jr. doing 'very well' after COVID-19 diagnosis,t3_jyhghm
,politics,t2_6bzqx,Trump appointed judges in Florida overturn ban on conversion therapy for minors,t3_jyhg8l
,politics,t2_52vl2q1z,Trump tells G20 leaders he wants to work with them ‘for a long time’,t3_jyhe14
,politics,t2_4aam3,Trump tweets undermine Michigan leaders; images show Chatfield drinking at Trump hotel,t3_jyhdoi
,politics,t2_7hpol8im,Biden faces a race against the clock for U.S. to rejoin Iran nuclear deal,t3_jyhbq0
,politics,t2_7hpol8im,Trump's monumental sulk: president retreats from public eye as Covid ravages US,t3_jyhazf
,politics,t2_6gxx0ar0,Cuomo tells Biden $500 billion in stimulus funds needed to bail out states,t3_jyh7e5
,politics,t2_78b44pca,Joe Biden could name most important Cabinet picks within days,t3_jyh5pq
,politics,t2_2ww8h29z,"As world leaders meet to talk pandemic, Trump checks out and hits the links",t3_jyh4cs
,politics,t2_4otl0ayv,Trump's 'Death Star' strategy: Forcing a fight over states' electors,t3_jyh2tm
,politics,t2_78b0uru0,Biden could announce Cabinet picks as soon as next week,t3_jyh1d4
,politics,t2_52vl2q1z,"McEnany: Trump's path to victory is Supreme Court, exposing 'systemic' voter fraud",t3_jyh1cz
,politics,t2_78b0uru0,Opinion | Who Will We Be Without Donald Trump?,t3_jyh09y
,politics,t2_52vl2q1z,Analysis | The Pa. county that explains how Biden won big while other Democrats struggled,t3_jygux6
,politics,t2_764zdakw,"G20 leaders meet to discuss help for poorest nations in post-Covid world, Trump golfs",t3_jygs2r
,politics,t2_52vl2q1z,Republicans demand Michigan delay certifying Biden win for ‘audit’ of Detroit vote,t3_jygqmu
,politics,t2_j6ia7,Trump nominee's long road to Fed may be dead end,t3_jygps8
,politics,t2_3zi4nxr,"A group of Michigan voters are suing the Trump campaign for disenfranchising Black voters, lawsuit alleges",t3_jygnzl
,politics,t2_y8mbk,"Here’s when Biden’s win becomes official — and how Trump is trying to prevent that | With key deadlines looming, derailing the certification of results is part of the president’s strategy",t3_jygnh6
,politics,t2_q9v5n,Joe Biden Turns 78 and Will Be the Oldest President — After Trump Broke the Record Right Before Him,t3_jygj58
,politics,t2_765r17fm,Twitter will hand @POTUS account to Biden on Inauguration Day,t3_jygf7w
,politics,t2_765r17fm,Biden could announce Cabinet picks as soon as next week,t3_jygf1z
,politics,t2_52vl2q1z,Who needs Russia? Loudest attacks on US vote are from Trump,t3_jygefw
,politics,t2_2pqvzp0x,GOP Michigan ex-governor says state board will certify Biden winner over 'bully' Trump,t3_jygbaz
,politics,t2_63uw6h9r,Judge rules against Trump global media chief after firings,t3_jyga4y
,politics,t2_jn0nv,NAACP Federal Suit: Trump Violated Voting Rights Act,t3_jyg71f
,politics,t2_7re1o302,"Battered by setbacks in push to reverse Biden win, Trump persists with fraud claims",t3_jyg473
,politics,t2_rfr0w,Trump Using Last Days to Lock in Policies and Make Biden’s Task More Difficult,t3_jyg34p
,politics,t2_39fos,"GOP Sen. Blackburn Calls Biden President-Elect, but Later Takes it Back",t3_jyfwyr
,politics,t2_7mfq73lx,Analysis: How Georgia proves Trump has no chance of winning,t3_jyfwel
,politics,t2_3mpp0,"Biden's likely pick to lead the Pentagon isn't a win for feminism - Michèle Flournoy might become the first woman in charge of the Pentagon, but it seems unlikely she’ll do anything to actually change US foreign policy for the better",t3_jyfv8a
,politics,t2_363do,"Trump’s Pennsylvania Suit is ‘Incoherent Conspiracy,’ Voters Say",t3_jyftsx
,politics,t2_iwi67,Twitter will transfer presidential accounts to Joe Biden on Inauguration Day,t3_jyfthv
,politics,t2_4p3tz78r,"China should be prepared in case relations with US get worse under Joe Biden, government adviser warns",t3_jyftcg
,politics,t2_d0rgw,"Tucker Carlson: Forget democratic norms, Democrats want to punish Trump and his supporters",t3_jyft5u
,politics,t2_ksxrr,Senator Shirkey and Speaker Chatifeld’s names projected on Trump International Hotel,t3_jyfrde
,politics,t2_3mgo4fkq,Trump tweets about election results and skips session on pandemic during G20,t3_jyfn88
,politics,t2_65qf4xi0,"Sen. Bernie Sanders: ""Thank God"" Joe Biden won the election",t3_jyfk0g
,politics,t2_2eef87e,"Most GOP Senators Stay Mum on Trump's Efforts to Challenge Election, After Washington Post Contacted All 53 of Them",t3_jyfjeg
,politics,t2_623gva0x,Biden faces a race against the clock for U.S. to rejoin Iran nuclear deal | KTAB,t3_jyfexo
,politics,t2_171qdp,I met ‘monster’ reality TV star Donald Trump 16 years ago. The reality of him has been monstrous . . .,t3_jyfd5c
,politics,t2_3xfdb5zg,Biden wades into coronavirus relief fight,t3_jyf3ye
,politics,t2_dfo2l,"Georgia GOP governor says he understands Trump's frustration, but maintains he's following state laws",t3_jyf2se
,politics,t2_3ie9x,Twitter will hand @POTUS account to Joe Biden on Inauguration Day,t3_jyf2rb
,politics,t2_8umxxbw,"Plagued by COVID outbreaks, the meatpacking industry could be forced to change under Biden",t3_jyewe9
,politics,t2_5fnnl5ch,Biden's popular vote lead over Trump stretches to more than 6m,t3_jyevyz
,politics,t2_43015hwl,"Trump Supporters in Georgia Threaten to Destroy GOP, Boycott Runoff Elections",t3_jyevov
,politics,t2_175lpk3j,Merrick Garland is being considered for Attorney General in the Biden administration,t3_jyeurt
,politics,t2_6m4nuk2w,Donald Trump Will Lose One Of His Twitter Accounts To Joe Biden On Inauguration Day. An account the president uses to retweet his conspiracy theories and vitriol will be wiped and handed over to the Biden administration.,t3_jyemqz
,politics,t2_3xfdb5zg,A new lawsuit alleges Trump’s effort to overturn Michigan’s election results disenfranchises Black voters,t3_jyeldv
,politics,t2_3n1iu89i,Trump’s last-ditch efforts to overturn results fail to make dent in Biden victory,t3_jyek1t
,politics,t2_8f2sk,Lara Trump reportedly mulling 2022 Senate run in North Carolina,t3_jyejvj
,politics,t2_3ayh8p6y,"No, Venezuelan communists did not interfere in the election. Yes, Trump’s legal team claimed that.",t3_jyehxb
,politics,t2_3xfdb5zg,Trump’s last-ditch efforts to overturn results fail to make dent in Biden victory,t3_jyeh3g
,politics,t2_3zi4nxr,"Wall Street Journal Bails on Trump’s ‘Conspiracy Theory,’ Says Giuliani is Not a ‘Serious Practicing Attorney",t3_jyegwu
,politics,t2_7hmeuo9c,"Donald Trump says 'I won, by the way' and lashes out at Pfizer claiming it delayed news of the COVID-19 vaccine until after the election",t3_jyefvb
,politics,t2_wwj7h,Biden to work to end executions as government sets 3 more,t3_jyeey7
,politics,t2_69yyt5ry,Trump to lose @POTUS Twitter account on January 20,t3_jyee44
,politics,t2_55pxc3rg,Biden team solicits donations to fund presidential transition as Trump administration blocks federal money,t3_jyedlw
,politics,t2_bqvitrk,"Rahm Emanuel Reportedly Being Considered for Biden's Cabinet, a Choice That Would Be a Slap in the Face to Black Voters",t3_jyecom
,politics,t2_3qo6zvfi,"GOP asks Michigan not to certify election results, citing ‘irregularities’ | The move follows speculation that Trump is seeking to persuade Michigan Republicans to override election results",t3_jyebbg
,politics,t2_2wzp4arj,"Joe Biden Owes His Victory to the Left. Organizers, not consultants, delivered key states like Pennsylvania, Arizona and Georgia.",t3_jyeb75
,politics,t2_3ni951zm,Trump admits Michigan Congressmen met to discuss coup,t3_jyd4va
,politics,t2_hj4mv,Trump Organization's consulting payments to Ivanka Trump are focus of NY tax probe,t3_jybzw2
,politics,t2_63uw6h9r,"Meet Pennsylvania’s anger translator, and Donald Trump’s worst nightmare",t3_jycwb6
,politics,t2_1t9tm8uf,Bypassing McConnell: Democrats push Biden to aggressively use executive power,t3_jydai0
,politics,t2_itr58,Biden's lead over Trump surpasses 6M votes as more ballots are tallied,t3_jybvym
,politics,t2_307tfg1g,Michigan group sues Trump campaign for alleged mass voter suppression,t3_jyat09
,politics,t2_706gk5tc,"Rudy Giuliani's quixotic frenzy has observers wondering if he may need Trump's protection | ""One explanation? He needs a pardon and he's trying to earn it,"" a CNN analyst says",t3_jyacke
,politics,t2_706gk5tc,Neal Katyal: All of Trump’s criminal immunity expires in about 60 days,t3_jyarxl
,politics,t2_zr8t03d,Trump's defeat by Joe Biden has triggered a huge wave of relief among the United States' European allies,t3_jy9p0n
,politics,t2_nlwmo,Trump Takes Another L: Michigan GOPers Say No To Election Steal,t3_jybdm3
,politics,t2_706gk5tc,"Shame the Random, Unknown Government Officials Aiding Trump’s Coup Attempt",t3_jycgfg
,politics,t2_u42v3,"NJ Democrat Calls for Rudy Giuliani, Other Trump Attorneys to be Disbarred",t3_jy8q5v
,politics,t2_13o6j0,Kayleigh McEnany’s Latest Trump Lie Is Firmly Debunked In Viral Video,t3_jyaacw
,politics,t2_nbu8k,Trump has longstanding history of calling elections 'rigged' if he doesn’t like the results,t3_jyd46w
,politics,t2_avobu,Barack Obama: ‘Donald Trump and I tell very different stories about America’,t3_jyamtf
,politics,t2_3pyz7h9y,"Dear Trump supporters: Those who egg on the president now, given the damage he does to America, are truly reprehensible",t3_jy93rj
,politics,t2_3mgo4fkq,"Yes, Donald Trump claimed fraud after the 2016 Iowa caucuses",t3_jybo0y
,politics,t2_js5a5,"With Trump sabotaging American democracy, the Russians don’t need to interfere",t3_jyc40v
,politics,t2_12jih9,Judge slaps down Trump appointee who has sought to reshape Voice of America and related agencies,t3_jya174
,politics,t2_3n1iu89i,Twitter to Meet With Biden Transition Team on Transfer of Social Media Accounts From Trump Admin,t3_jyd52j
,politics,t2_175lpk3j,Steve Mnuchin Is Doing His Part to Sabotage the Biden Administration on His Way out the Door,t3_jy9p2e
,politics,t2_uljp2,Trump tries to drum out GOP election officials who won’t play his games — Georgia Secretary of State Brad Raffensperger's family has received threats and he expects a primary challenge in 2022,t3_jybnek
,politics,t2_1qekv722,"Let's count the ways Donald Trump has tried to subvert this election, shall we?",t3_jy9asn
,politics,t2_123jub,Biden's margin of victory over Trump surpasses 6 million votes,t3_jy3mhv
,politics,t2_1t9tm8uf,"In 'Tremendous Rebuke' of Trump Appointee, Federal Judge Bars US Media Agency Head From Interfering in News Coverage | ""Michael Pack has repeatedly and intentionally violated the First Amendment rights of VOA journalists.""",t3_jye7eu
,politics,t2_3s0vy,Senators who urged ‘voters to decide’ impeachment won’t admit Trump lost the election,t3_jy58b1
,politics,t2_2zkft261,Will Trump Screw Up Republican Efforts to Hang Onto the Senate?,t3_jybv6o
,politics,t2_d29iz,Conservative News Site Warns Trump: 'Concede And Move On',t3_jy7n7y
,politics,t2_4qof1jwa,"U.S. Sen. Marsha Blackburn, a Trump ally, refers to Biden as 'president-elect'",t3_jy30hq
,politics,t2_3xfdb5zg,Why Can Trump Try To Steal The Election? Blame The Electoral College.,t3_jycdqu
,politics,t2_530116vq,Trump options narrow as Michigan backs Biden win,t3_jyc5ef
,politics,t2_123jub,Twitter says it will give @POTUS account to Biden on Inauguration Day,t3_jy1h8p
,politics,t2_guf36,Conspiracy theories are Trump ‘weapons’ in desperate bid to cling to power,t3_jyauqo
,politics,t2_69yyt5ry,Michigan attorney general ponders criminal probes of state and local officials who bend to Trump’s will on overturning election results,t3_jy2k5b
,politics,t2_211xju1y,US Chamber of Commerce chief calls on Trump to stop delaying transition to Biden presidency,t3_jy853m
,politics,t2_z6d1p,"Steven Mnuchin Swears He’s Not Tanking the Economy Just to F--k Over Joe Biden: Strangely, not everyone believes him.",t3_jy2blr
,politics,t2_2xtgcf45,Donald Trump Jr tests positive for coronavirus,t3_jy0nxd
,politics,t2_2gol75lf,"Trump considers targeting birthright citizenship with executive order in his last weeks in office, report says",t3_jy94n0
,politics,t2_63uw6h9r,Rudy Giuliani's Son Potentially Exposed Most of Trump's Legal Team to COVID During RNC Press Conference,t3_jy0een
,politics,t2_8h9xl,"After Trump meeting, Michigan GOP lawmakers say they’re not aware of any info that would change Biden’s victory in state",t3_jy06aa
,politics,t2_kxxcy,"Biden will receive @POTUS Twitter account on Jan. 20 even if Trump doesn't concede, company says",t3_jy38ap
,politics,t2_imv8v,"The Trump campaign’s much-hyped affidavit features a big, glaring error",t3_jyca1s
,politics,t2_12sxoak6,Arizona’s largest county certifies Biden win over Trump,t3_jy2j68
,politics,t2_ys7tq,Michigan and Georgia Republicans Just Crushed Trump’s Coup Dreams,t3_jy0o3b
,politics,t2_bm2u7,"After Trump meeting, Michigan GOP leaders say Biden's win still stands",t3_jy1qop
,politics,t2_65qksjue,Letters to the Editor: Stop Donald Trump's coup. Impeach him again,t3_jy46k6
,politics,t2_4na27gac,"Twitter will hand @POTUS to Biden on Inauguration Day, even if Trump doesn’t concede",t3_jy0iwa
,politics,t2_3jjsa,The Danger (and Ineptitude) of Trump’s Failed Coup,t3_jyaidt
,politics,t2_cez5h,Ivanka Trump distances self from dad’s election fraud claims as her own legal jeopardy grows,t3_jxze94
,politics,t2_avobu,"Voice of America's 5 Months Under Trump CEO: Lawsuits, Bias Claims, And A Sex Scandal",t3_jyc1ze
,politics,t2_8f382,Bernie Sanders says the 'GOP has ceased to be a political party' and 'is now a cult' for staying silent on Trump's election attacks,t3_jxxkww
,politics,t2_tribz,Biden will receive @POTUS Twitter account even if Trump refuses to concede,t3_jy9t3x
,politics,t2_148xic,Georgia governor certifies presidential electors for Biden,t3_jxz8g9
,politics,t2_cw1518p,"Business and World Leaders Move On as Trump Fights to Reverse Election | President-elect Joseph R. Biden Jr. is seizing the moment, not to aggressively confront the president he defeated, but to act presidential in his stead.",t3_jyby64
,politics,t2_63uw6h9r,Trump refuses to take questions after falsely claiming he won election in first media appearance in weeks. No sitting US president has falsely claimed an election victory from the Brady Briefing Room. Until Friday,t3_jxxiya
,politics,t2_39fos,The Fed Could Help Cash-Strapped Cities and States. Mnuchin Has Other Ideas. | The lame-duck Treasury secretary seems to want to sabotage Biden’s ability to stave off the pandemic’s economic impacts.,t3_jydi88
,politics,t2_c9v1w,Trump supporters plan D.C. rally two days before electoral college votes are cast,t3_jyd786
,politics,t2_4ewk589g,GOP lawmaker patience runs thin with Trump tactics,t3_jyau1p
,politics,t2_hhq3wyu,Michigan group sues Trump campaign citing disenfranchisement of Black voters - The plaintiffs say the campaign's legal challenges to the election violated their voting rights.,t3_jy4cdz
,politics,t2_p40bi9p,Trump accuses Pfizer and Moderna of working to stop his re-election,t3_jxwbg1